entity,platform,review_id,rating,text,date,app_version,title,compound,pos,neu,neg,sentiment
jupiter,app_store,13806239670,1,I use this from 2 years now facing a problem no support from customer care team. I stay in Bangalore Karnataka because it’s Jupiter account it opened in kochi Kerala,,,Customer care support is not good,-0.1921,0.091,0.768,0.141,negative
jupiter,app_store,13800766833,5,Easy to use,,,Great experience,0.4404,0.592,0.408,0.0,positive
jupiter,app_store,13800529854,1,I am facing this issue since December 2025 where the jewel received in November and December months says redeemable if you maintain pro status next month. Now its March still i see that same message and the pro status says renews on 3 jan 2026. Not sure if that is a glitch or some trick bu the company but this issue is not allowing me to redeem good amount of jewel i have. The support team has no solution for this and the amount is blocked.,,,The app was good but looks like now they are playing tricks with jewel redemption,0.7735,0.126,0.795,0.078,positive
jupiter,app_store,13798614718,3,"Jupiter is one of the best finance app that has beautifully designed & intuitive spend analysis. They do have bunch of other problems like below average customer support. Bot in the app doesn’t understand basic English. If you can improve on your customer support, you could win more customers",,,"Mixed experiences- Spend Analysis best in class, bad customer support",0.9628,0.34,0.619,0.041,positive
jupiter,app_store,13797665825,5,I really like this app while I’m using every time learn more things. So sort out and easy to understand everything in that app. I love specially Pot section. One of the best app in finance.,,,Wonderful app,0.9336,0.306,0.694,0.0,positive
jupiter,app_store,13789177821,2,"Initially, they were offering a free account with zero balance, then after few months they asked to maintain minimum 10,000 to get debit card annual fee waived off then again after sometime they asked to open another FD to open for minimum 10 K amount to get the same benefits. Later on , again after few months, they asked the same, to maintain one more 10K FD and again I did the same. Then again after sometime, they have changed the terms and conditionsthat and now Debit Card fee is not waived off, even after fulfilling all these conditions. Regarding cashbacks, not usable at all, you can use those to buy gift cards and the conversion rate is so low. Also there is a minimum conversion fee as well",,,Keeps changing terms and conditions,0.7997,0.079,0.901,0.02,positive
jupiter,app_store,13786470723,1,This application is not working in my phone iPhone 10,,,App not working,0.0,0.0,1.0,0.0,neutral
jupiter,app_store,13786155157,1,I had applied for credit card for which I was too above from their eligibility criteria then too my card got rejected. Secondly that was not the problem but atleast you should intimate that what was the reason for rejection …,,,Not a great app,-0.6674,0.072,0.782,0.146,negative
jupiter,app_store,13785733166,1,My salary account is suddenly showing –₹9000 without any visible transaction or auto-debit. There is no explanation in the app. This is extremely concerning and unacceptable for a banking app. Balance transparency is the most basic requirement. This kind of issue creates unnecessary stress. Please fix your backend systems and provide clear transaction details.,,,Minus balance,-0.3102,0.111,0.759,0.131,negative
jupiter,app_store,13784789711,1,"This app took all my permission but didn’t allow me apply for the card after first time after CIBIL check , I have score of 786 how much more you want ??",,,Very bad app,0.554,0.132,0.868,0.0,positive
jupiter,app_store,13779799166,1,"I have been trying to sell my gold since 4 months now and the transaction keeps failing , I have mailed them several times, still got to no resolution, they are not returning my money , it’s a big amount",,,"They are scammers , stay away",-0.6705,0.0,0.874,0.126,negative
jupiter,app_store,13775769725,1,Once loan is approved and VKYC is done it is stuck at checking screen. No option to email or call customer care for the issue. Found email somewhere in documentation and emailed but no response from customer care. Wastage of time and energy.,,,Simply Useless,0.6059,0.19,0.696,0.114,positive
jupiter,app_store,13775685459,1,I am unable to add my Debit Card As expire day Validation is incorrectly handled Please fix it ASAP. Even though I have entered expected format MM / YY but still it fails validate,,,Fix Add Expire date textfield validation Bug,0.0516,0.124,0.783,0.093,positive
jupiter,app_store,13773769345,1,i don’t know where is my money going through this app it tensed me so much balance is zero my money are gone,,,no money in my account,-0.25,0.0,0.917,0.083,negative
jupiter,app_store,13767765737,5,"No ads, no cluttered UI. Just simple, aesthetic, and functional",,,Best UPI App on the market,-0.0803,0.156,0.662,0.182,negative
jupiter,app_store,13762085979,1,Hi applied for CSB Bank edge rupay credit card I have some questions to ask them and there is no such way to connect to them neither via chat nor via call. Under start Chat section there is no option to select CSB Bank edge rupay credit card and when I call on customer care number they are asking last 6 digits of card which has not been issued yet.,,,Worst Customer Care Service,0.6486,0.124,0.819,0.056,positive
jupiter,app_store,13758226082,3,"Please bring back to chose the categories of expense on the front of transaction so that i can select the categories of transaction while complete the transaction as we are doing this priviously,now its difficult to catagories the transaction as i need to go to the trasaction and then catagories Also give option to create category as well",,,Categorisation on front of transaction,0.4588,0.103,0.857,0.04,positive
jupiter,app_store,13741807032,1,"Actually, this bank is a fraud they have mentioned that they are having a 0 balance account and I have trusted and open an bank account now I got a charge of 1,500 it’s noting for bank as they are saying they have changed the polices but having a corporate job i know my losses is very big and at the end of the month I left as without money due to this bank error.",,,False news,-0.8151,0.025,0.86,0.115,negative
jupiter,app_store,13741392370,1,Do not go for their CSB rupay card it’s a scam no offer will be provided and their after sales service once you get the card is third class would recommended users to be beware of such fraud app,,,Scam App,-0.836,0.039,0.753,0.209,negative
jupiter,app_store,13736713067,1,This app was a brilliant artwork but now it’s not working on my iPhone 8plus it’s shows update when. Open app but when I check AppStore I does not show any update it show open kindly help ke and they always ask for rbi mandate,,,Help,0.882,0.196,0.804,0.0,positive
jupiter,app_store,13734043656,1,"With every update, this app keeps getting worse. Basic things like transaction history are now unnecessarily hidden and no longer visible on the home screen. Showing Pots on top while pushing the current account balance down makes no sense for a banking app. The UI feels cluttered and over-engineered, forcing users to take extra steps for simple actions. These constant redesigns are hurting usability instead of improving it.",,,From Best UI to Worst UI ever,-0.4767,0.091,0.779,0.13,negative
jupiter,app_store,13733401438,1,"Every other process was smooth except when trying to capture photo for verification for credit card onboarding, the photo circle comes black and the image is not showing up. Look into this developers pls.",,,Not able to capture photo for verification,0.4404,0.109,0.891,0.0,positive
jupiter,app_store,13733231039,1,"It’s been close to 24 hours I’m trying to connect to an agent, neither I’m getting any help in that and the chat bot is useless, my card is blocked and requested for a re-issue the card, it says I am not eligible but deducted the re-issuance charges immediately. Pathetic service and no way to get a resolution, it’s really frustrating and hopeless",,,Very Poor Customer Service,-0.9674,0.023,0.692,0.285,negative
jupiter,app_store,13732957780,1,Useless app and customer support also worst never done.,,,Fake promise,-0.6369,0.173,0.385,0.442,negative
jupiter,app_store,13729394400,1,"I am writing to express my deep disappointment with the transition process during emergency situations. It has proven extremely challenging to reach customer support, and unfortunately, no resolution has been provided despite my efforts.",,,Transition issues,-0.675,0.137,0.621,0.242,negative
jupiter,app_store,13725857552,1,"App is good, it’s sad that i have to close my account due to 5000 min account balance maintenance",,,"App is good, it’s sad that i have to close my account due to 5000 min account balance maintenance",-0.0516,0.126,0.739,0.135,negative
jupiter,app_store,13723446078,1,"I didn’t wanna a credit card, just wanted to check the interface and use for UPI transactions, it made me register my PAN and Aadhar and didn’t let me go in the home page, the back button doesn’t work. Delete my data, I don’t want the app",,,Worst app,0.4404,0.08,0.92,0.0,positive
jupiter,app_store,13722180981,5,"It's great experience to use this From another banks Good server maintenance and easy to use,",,,Greatt,0.872,0.432,0.568,0.0,positive
jupiter,app_store,13721824482,1,"Though they promise ten percent cashback on payments in amazon, zudio and trends; it doesnt work always. Last time i made a transaction in Zudio using their edge credit card, i just got one percent cb. Same happened for transaction in amazon now. Previously i had a similar experience in Trends and then i was able to get it resolved by contacting customer care. But nowadays their customer care number is also not reachable as it only connects me to chatbot which keeps repeating the eligible seller names.",,,Pathetic customer service,0.8847,0.161,0.839,0.0,positive
jupiter,app_store,13719357942,1,"FRAUDD , It gives 10 percent for few days then the cashback drops to 1 percent automatically, i tries to take help but no customer care representative only useless AI BOTS who can not understand anything just repeats the same thing again and again",,,"FRAUD , complete fraud",-0.8439,0.036,0.772,0.192,negative
jupiter,app_store,13718622246,1,"There customer support is terrible, chat and call is not working",,,Horrible Experience,-0.1027,0.182,0.608,0.209,negative
jupiter,app_store,13710700809,5,The credit card transactions are failing and there’s nobody to contact. Customer care just puts you on hold forever,,,No response from Customer care,0.3612,0.231,0.637,0.131,positive
jupiter,app_store,13708010856,1,It is one the worst app ever will call you for stupid stuff but if you got to there support no one is ever available and once you went kfflibe agter 30 mins someone will reply and close the chat,,,Worst app no support,-0.2023,0.077,0.784,0.138,negative
jupiter,app_store,13707737227,1,Can’t reach customer service. Rewards are not credited. Will close the account,,,Pathetic,0.2709,0.274,0.588,0.138,positive
jupiter,app_store,13705756933,1,"App is waste of time, while credit card application if go back it'll forget the ongoing application including the CIBIL enquiry it made. You'll have to rehit CIBIL and refill application fully again, only to be get declined instantly despite showing approved limit of 7L",,,Multiple enquiries still not card approved,-0.5318,0.051,0.81,0.139,negative
jupiter,app_store,13703530911,1,You are ripping of your company hard money if i order something from say flipkart i get rewards coins what if i return the item or cancel it the reward still stays fix the loophole,,,Loophole rewards,0.6597,0.165,0.752,0.083,positive
jupiter,app_store,13700147828,1,"I have been using Jupiter more than 2 years but I recently invested in gold last year , when I tried selling my gold when it was its peak . almost 20 times the process got failed in 2 days. I don't know Am I ever gonna take back my money . This is not a safe platform to invest in gold or funds . All my friends who were using Jupiter for SIP are now switching to Phonepe . Please guys don't use this app , this app is not safe .",,,Not a safe platform,-0.5526,0.067,0.832,0.101,negative
jupiter,app_store,13699873571,1,"These people purposely make it hard to delete account. Go to FAQ and search the word, zero results. No in chat support either. 3rd rated app",,,"Avoid creating an account, you can’t delete it later",0.0258,0.092,0.785,0.123,neutral
jupiter,app_store,13692039061,1,No one ever responds or chat or support,,,No support whatsoever,0.128,0.248,0.55,0.202,positive
jupiter,app_store,13684936515,1,Good app until your money get stuck or u have any issue. customer support don’t know anything at all . Jupiter just try to blame federal for every problem . My own pot account get dormant due to inactiveness .more than 1 month passed but They are still not able to activate it . Let’s see when it going to be active .,,,Just a scam app with  white labelling,0.5106,0.106,0.821,0.073,positive
jupiter,app_store,13684305140,3,Why is it taking more than 15 mins to install the app ?,,,Taking forever to install,0.0,0.0,1.0,0.0,neutral
jupiter,app_store,13676573485,1,When the app top leads talk they talk of a premium experience while the team fails to deliver it to the core. My pots account has been marked dormant due to no transactions. No worries. The TAT for reopening it is 48 working hours. For that i had to visit the partner bank i.e. Federal Bank . Post doing it on 17 Jan 2026 the account is still dormant. The support team at Jupiter raises complaints with base level escapist answers. Why are you guys running a service you cannot commit. The escalations matrix is lax . Today is 26 Jan and am still not able to mobilise my own funds. Exasperating experience. Incompetent jupiter team and the partner bank. Jupiter a bog mistake.,,,Escapist operations. Support is a pain.,-0.7482,0.063,0.827,0.109,negative
jupiter,app_store,13672887673,4,"Great app with a smooth and reliable experience. The features work well and are easy to use. One suggestion would be to add a dark theme, which would make the app more comfortable to use and align it with other modern apps. Looking forward to more useful updates.",,,dark theme,0.9421,0.27,0.73,0.0,positive
jupiter,app_store,13671384906,5,Excellent app,,,Transfer without lag,0.5719,0.787,0.213,0.0,positive
jupiter,app_store,13671361707,1,Unable to use Jupiter app for payment on all the shopping apps in IOS 26.2 version. Jupiter UPI is not discoverable in any of the app while doing payment. I have downloaded latest version of the app. Still problem remains same,,,Unable to use Jupiter UPI in IOS 26.2,-0.4019,0.0,0.937,0.063,negative
jupiter,app_store,13669230058,1,"Worst experience, while KYC federal bank representative told there is difference in father name entered, while I spent hours to to connect with Jupiter chat / call support but I can’t, no one is working they only set up automated answer for some questions and , send feedback that’s it , at end I have to close all Jupiter stuff and closed account , thank you",,,No way to connect Jupiter chat or call service,-0.0644,0.07,0.856,0.074,negative
jupiter,app_store,13668859688,1,Worse appp ever Shows 50rs cashback and After payment no cashback willl be received worst and worst,,,Worst,-0.926,0.0,0.491,0.509,negative
jupiter,app_store,13665905433,1,No customer care number.,,,Annoying,-0.5466,0.182,0.14,0.677,negative
jupiter,app_store,13665259855,1,After using edge credit card for one week they blocked the transaction and in resolution after following up for 4 days they come to the conclusion that card need to be closed.,,,Edge Credit Card Blocked,0.128,0.075,0.865,0.061,positive
jupiter,app_store,13663441572,1,Worst starting for redeem jewels to cash is 20jewels - 1 rupee each Later 100jewels minimum- 20 rupees Now 2500jewels minimum Worst app,,,No cashback or jewels,-0.7351,0.096,0.641,0.263,negative
jupiter,app_store,13662882821,1,"This bank stated while opening a account that it’s a zero balance, a while later they deduct fees and charged for physical card, but never gave me a debit card! Raised complain but no response! But the definitely don’t forget to charge us money for the same!",,,Over smart Nano Banking,-0.7291,0.063,0.747,0.19,negative
jupiter,app_store,13661815392,1,"Fake money tracker, Chor app once registered they don’t provide any way to de register your UPI please don’t download app or register any way.. further more, they don’t have chat Support, they track and know about all your wealth and know very well How to use it beware. And at last, they provide a form saying that we will address your issue and do nothing, once again Please do not use this app or download.",,,Fake money tracker chor app,0.6737,0.124,0.817,0.059,positive
jupiter,app_store,13661764716,2,"The all part of online bank is to get quick and easy access to things, but whenever I try to do something on this app like adding a nominee or something new they started their servers are always on a lunch break and I get a technical error message",,,Slower than offline banks,0.1655,0.095,0.84,0.065,positive
jupiter,app_store,13660795720,1,"Jupiter pretends to be a modern, friendly fintech, but the reality is a predatory money-extraction machine with a polished interface and ruthless backbone. First, they drown you in loan and credit card offers, bombarding you with notifications, ads, and gentle-sounding nudges that are anything but gentle. The goal isn’t convenience — it’s to push you into credit products so they can start charging. Once you take a loan or use their credit facilities, everything changes. A minor delay is treated like a moral crime. Instead of clear communication or rational support, you get harassment and pressure tactics that feel designed to intimidate. Respect, empathy, and professionalism evaporate the moment money is on the line. Support is useless, escalation goes nowhere, and transparency is a joke. Every query about charges, interest calculations, or repayment terms gets deflected with scripted responses that dodge real answers. And the worst? When you try to close your account, Jupiter doesn’t let you go without paying up. They charge you to exit the very ecosystem they lured you into. Paying to leave your own account isn’t just bad policy — it’s exploitation. This is not user-centric finance. It’s a bait-and-switch racket where: • You’re pushed into loans and credit with endless prompts. • You’re harassed over tiny delays with foul and aggressive tactics. • You’re penalized with hidden or opaque fees. • You’re asked to pay even to close your account. Jupiter doesn’t offer financial empowerment — it offers financial entrapment. ****Stay as far away as possible.**** I would really appreciate if Apple developers restrict this application and completely remove it from AppStore because it’s a scam application.",,,⭐ A Financial Trap From Sign-Up to Sign-Out — Avoid Jupiter at All Costs,-0.8753,0.139,0.694,0.168,negative
jupiter,app_store,13654357839,1,I’ve been trying to open my Jupiter account from past couple of years. But every-time when I enter my mobile number to signup. After successful SMS verification it states “Your profile doesn’t match Jupiter Policies”. Which leaves me curious which kind of policies they have that I can’t open a Jupiter account inspite of having a stable CIBIL history and everything.,,,Not able to open Jupiter Account,0.9081,0.179,0.821,0.0,positive
jupiter,app_store,13654146311,1,"If you are not offering loans, don’t send texts saying loan available. Only send updates when you are able to offer loans.",,,Spam!!,0.0,0.0,1.0,0.0,neutral
jupiter,app_store,13644758516,1,"Problem : UNABLE TO LOGIN TO MY ACCOUNT using biometric or MPIN, tried to reset the same - with debit card its throwing an error saying something went wrong with biometric something went wrong again Pain: Overall my money is stuck NO WAY OUT : When called on customer very conveniently they said it take 3 working data First thing after this gets unlocked SOLUTION : FIRST THING TO GET THE FUNDS Released AND ADD THEM TO TERMINATIONAL BANKS NOT these NEO BANKING SERVICES lesson learnt",,,YOUR MONEY GETS BLOCKED IF DUE TO TECH REASON AND IT TAKES YEARS TO GET IT RESOLVED,-0.9413,0.03,0.773,0.197,negative
jupiter,app_store,13642086402,4,"In bill payment, HDFC NetBanking is not available. HDFC is a popular bank. Also I didn’t get all benefits they promised like free subscription.",,,Needs improvement,0.9136,0.419,0.581,0.0,positive
jupiter,app_store,13635348958,2,App is asking me to enter mpin but when i click on unlock with mpin it shows something snapped. Can you fix this?,,,MPIN issue,0.0,0.0,1.0,0.0,neutral
jupiter,app_store,13635260179,5,Never disappointed,,,Perfect UPI,0.3724,0.719,0.281,0.0,positive
jupiter,app_store,13632879610,1,"App fails after depositing money, cant go forward or backward hoe many time we open, no option to reach support also",,,Worst app,-0.296,0.147,0.659,0.194,negative
jupiter,app_store,13617753166,1,They just take your data for credit card but reject it anyway saying some nonsense reason everytimr,,,Pathetic,-0.743,0.079,0.611,0.31,negative
jupiter,app_store,13617321461,1,"I am stuck on vkyc page, Getting one annoying error for last three days .""we promise this hardly happens, please give me another shot"".... mail about this but still no solution... please work on your app",,,App is not working,-0.7118,0.075,0.686,0.239,negative
jupiter,app_store,13616333567,1,Such a worst app i have ever seen no customer support no mail reply nothing don't use this type of useless app.,,,Worst app zero customer support,-0.911,0.0,0.556,0.444,negative
jupiter,app_store,13615360923,3,"While reviewing my Magic Spends transactions, I noticed a failed transaction (Gold purchase) where the amount was debited from my account but no refund has been processed. Upon further verification, I found multiple similar instances where funds were debited for failed transactions, but the corresponding refunds were not credited. To resolve this matter, I attempted to contact Jupiter support through the following channels: 1. In-app chat: I was advised to raise the issue through the “Raise Dispute” section 2. Raise Dispute section: I received a message stating that Federal Bank does not address such transactions and was asked to contact Jupiter Customer Care directly 3. Customer Care call: Despite waiting for over 10 minutes, I was unable to connect with a representative 4. Mailed to customer care..with all details and screenshot of my difficulties in contacting them but I keep getting one mail asking for some more time....recently that also is not there. Careful with New age fintech companies making it difficult to contact them in case of issue. I couldn't get a simple clarification even after multiple attempts so there is no way I can continue to trust the platform.",,,All good till you have issue,-0.8596,0.08,0.789,0.131,negative
jupiter,app_store,13614496004,1,they can't deliver a single service of recharge. customer care is careless & rugged services. please avoid such companies who will anyways not run longer. Very bad not even deserves a single star.,,,Worst Services,-0.4576,0.131,0.667,0.202,negative
jupiter,app_store,13611756580,1,Do not even download this app. 6 months and it just shows something is cracked. No customer support nothing. Worst app in the market.,,,Pathetic app,-0.0423,0.115,0.73,0.155,neutral
jupiter,app_store,13604125357,4,I am not able to complete my video kyc to enable pots. It just keeps spinning and never allots a person to complete it.,,,Can’t get KYC done,0.0,0.0,1.0,0.0,neutral
jupiter,app_store,13596958445,1,"Unfortunately, the experience was highly disappointing. The matter was not handled professionally, and I did not receive proper assistance or a satisfactory explanation",,,Fraud,-0.4641,0.134,0.661,0.205,negative
jupiter,app_store,13596567319,1,"There No Any Contact Support from this App when I Starting my VkYC for That CC but There Is An error due to My Address after 2,3 try I Have Try To edit My Address but There Is no option to Edit My Address And there is No Any Help and Support from this App So Pls Don’t Use This App there Are many more Apps Are In Market.",,,Worst App Ever,-0.729,0.091,0.743,0.166,negative
jupiter,app_store,13584903761,1,Literally the worst banking app ever!!! Unable to reset any pins! No customer support!,,,Worst banking app,-0.8666,0.0,0.531,0.469,negative
jupiter,app_store,13575219495,5,Toooo good!,,,W banking app,0.4926,0.761,0.239,0.0,positive
jupiter,app_store,13573553687,1,I faced a technical issue with data in the app not upload even after a month of the transactions. Team didn’t show any ability to respond or resolve the issue even after multiple escalations on email. Terrible experience and very misleading marketing! Stay away from Jupiter and even their CSB credit card.,,,Non existent customer support,0.1776,0.128,0.772,0.1,positive
jupiter,app_store,13572402163,3,Takes time to load,,,App takes time to load hence becomes inconvenient for payment.no purpose is accomplished,0.0,0.0,1.0,0.0,neutral
jupiter,app_store,13565189153,1,Don’t go on ada,,,Worst App,0.0,0.0,1.0,0.0,neutral
jupiter,app_store,13557543077,1,"I am extremely disappointed with the Jupiter card and its rewards system. They clearly promised 1% rewards/cashback on every transaction above ₹100, but I have not received any rewards on my eligible transactions so far. There is no 1% on UPI, no 1% on credit card spends, and no visible “jewels” or cashback being credited to my account as advertised.",,,Very disappointing rewards and service,-0.3874,0.161,0.656,0.183,negative
