entity,platform,review_id,rating,text,date,app_version,title,compound,pos,neu,neg,sentiment
jupiter,app_store,12930536665,1,"My account was closed on 3rd July 2025 due to the video KYC not being completed. At the time of closure, there was a certain amount in my account. I was initially okay with the delay, as I was informed that the refund would be processed within 14 working days — by 17th July 2025. However, when I followed up on 17th July, I was informed that there would be an additional delay of 6 working days due to bank holidays. Though frustrated, I agreed to wait until 23rd July 2025. As of 23rd July, I have still not received the amount. Upon contacting your support team again, I was told a complaint would be raised and the refund process would be re-initiated — and that it would now take another 16 days. This is completely unacceptable. I am extremely frustrated, as this is my hard-earned money, and every time I reach out, I receive vague or inconsistent responses from your support team. No one seems able to take proper ownership or provide a clear resolution. If this issue is not resolved immediately and the refund is not processed without further delay, I will have no choice but to take legal action against your company for withholding my funds.",,,The worst app ever,-0.278,0.073,0.85,0.078,negative
jupiter,app_store,12923112242,1,No support available,,,No support,-0.3089,0.0,0.47,0.53,negative
jupiter,app_store,12918914987,4,"Hello, first of all I want to say that not everyone have gmail account, someone has email account in ymail, hotmail etc. In my case I have to create a gmail account for that issue. Jupiter is not supporting other mail client only gmail. Please solve this asap. Then the app design is good but not easy to understand. Design the app in a simple yet very powerful. I have some proposal for the improvements 1) Jupiter bank account is not supporting. So please show the primary account 2) Make a option to pay credit card bill payment via debit card. Not every one is using UPI for bill payment. 3) create a options for “Offer” zone don’t show etc etc “off” in mail section. 4) Please disable the options which Jupiter has but not accessible ( when available then activate this options) Thank you",,,Try to create a simple yet powerful app,0.9613,0.183,0.761,0.056,positive
jupiter,app_store,12918223083,1,Most bank do not care how their app is behaving in apple devices. Jupiter you did the same. My KYC done photo Geordies nominee updated and the process started 2 hours back and it’s going on and on And funny part is message displaying “it usually takes less than two minutes ”,,,Savings account opening is in progress since last 2 hours,0.0701,0.052,0.9,0.047,positive
jupiter,app_store,12909736504,1,Don’t use this bank account every month cutting your money don’t use this aap,,,Waste bank,-0.128,0.0,0.897,0.103,negative
jupiter,app_store,12905479754,1,Unable to complete kyc getting stuck on Identify verification page. After clicking on start video kyc page is stuck on it. Its been more than a week but getting same issue,,,KYC Issue,-0.25,0.0,0.906,0.094,negative
jupiter,app_store,12902397866,1,IF YOU ARE NOT PROVIDE VALID RESON FOR NOT START AAP ACCOUNT SO WHY YOU ADVERTISING 0% CUSTOMER SUPPORT,,,0% SERVICE,0.5319,0.16,0.84,0.0,positive
jupiter,app_store,12902272752,1,Fake service showing,,,Worst service,-0.4767,0.0,0.392,0.608,negative
jupiter,app_store,12897034091,1,One of worst banking service ever experienced. Looting customer by keeping too many hidden charges which makes the bank service unbearable.,,,Too many bugs and worst banking,-0.7351,0.0,0.754,0.246,negative
jupiter,app_store,12890100425,1,Most Useless App on Appstore,,,Most Useless App on Appstore,-0.4754,0.0,0.564,0.436,negative
jupiter,app_store,12883164560,5,"The app functionality is superb. However, it would be immensely beneficial if you could provide us an option in the Jupiter app to create a widget for SCAN QR code for payment like all other UPI and payment apps.",,,Best app for rewards in UPI,0.891,0.249,0.751,0.0,positive
jupiter,app_store,12878376567,1,Not satisfied with the KYC process . They have checked the PAN and still they make you wait and ask to see if the PAN CARD logo is shining or not . Quite an irritating process and better to avoid this stupidity.,,,The KYC process is totally irrelevant.,-0.8066,0.057,0.724,0.219,negative
jupiter,app_store,12876860105,1,Scam,,,Scam,-0.5719,0.0,0.0,1.0,negative
jupiter,app_store,12872287194,5,Best app financial assessment,,,Wellness coach Namrata,0.6369,0.583,0.417,0.0,positive
jupiter,app_store,12871010023,1,to choose a dark mode appearance and make the face id faster on iphone or put an option to turn it off so that i can put lock on it myself through ios app lock,,,Give us option,0.0,0.0,1.0,0.0,neutral
jupiter,app_store,12859510653,1,"I am trying since 4 months now, not able to update the Loan details form. And what kind of field is the interest rate? We can’t even type dot(.) in the field. Please fix this ASAP",,,Loan Details Update Form Not Working,0.6486,0.135,0.865,0.0,positive
jupiter,app_store,12850433853,2,"I have installed jupiter and tried to open a savings account in jupiter app, it is showing a message on the screen like “unable to open account, your account application is rejected by our systems. We will not be able to open an account for you. “ please help here",,,Not able to open savings account in jupiter,0.4939,0.132,0.81,0.058,positive
jupiter,app_store,12845901441,4,Everything looks great works great except theres no dark mode and no qr scanner widget for lock screen. Cred has it but i dont wanna use cred.,,,"It’s great, but you should add dark mode and most importantly a QR scanner widget for lockscreen.",0.4404,0.163,0.735,0.102,positive
jupiter,app_store,12842717216,2,"No proper response, actually there is no proper app support, it has only automated replies. I have done fixed deposit unable to withdraw from months. Mailed them they told to redo KYC, even then no use, even now the problem persists.",,,Looks fine not up to the Mark,-0.6808,0.056,0.75,0.194,negative
jupiter,app_store,12838433078,1,They said that you can make an account with 0 balance but they are now charging money without any notice. 600rs they have taken from my account and they are saying that you have not maintained you avm balance I recommend you don't you this app!!!,,,Fraud app,0.6281,0.084,0.916,0.0,positive
jupiter,app_store,12834118776,5,A good app for tracking expenses and Incomes but need to show note also for the transaction which is entered at the payment.,,,Helps in tracking money,0.2382,0.081,0.919,0.0,positive
jupiter,app_store,12827209294,1,Team I have closed the savings account on account of non debit of funds in for purchase of gold in Jupiter app. So the remaining investments in this app could not be redeemed. Kindly provide a solution to open a new account or to redeem the gold investment. Thanks,,,Redeeming the gold,0.1556,0.095,0.821,0.084,positive
jupiter,app_store,12824122977,1,Worst app ever and even fraudulent too. Once you change the phone you can never get back cash back points nor can use this app again as always showing u know error which can not be resolved as there is no any point of contact to get the issue resolved,,,Worst app,-0.9005,0.029,0.741,0.231,negative
jupiter,app_store,12818587654,1,"This is the worst app I have seen regarding banking service, even if u have zero balance account thy debit ur money for minimum requirement and im a student I cannot afford their minimum requirement nearly 2000₹ have been debited from my account , and Im literally in tears for my money , please don’t download the app anyone !!!",,,Worst app,-0.6784,0.035,0.861,0.104,negative
jupiter,app_store,12818225403,1,Pathetic service!,,,Vkyc issue,-0.6114,0.0,0.2,0.8,negative
jupiter,app_store,12815028669,1,Don’t ever use Jupiter its automatically deducts thousands of rupees from your account when you ask in customer care they will not refund back your money,,,Dont use Jupiter,0.4939,0.113,0.887,0.0,positive
jupiter,app_store,12806530834,1,"I am writing this to express my deep dissatisfaction with the way your bank has handled my account and the lack of professionalism shown throughout the process. Without any prior notice or communication, my account was frozen, leaving me unable to carry out essential transactions. When I contacted your customer service team, I was told to simply wait for two days without any proper explanation or resolution. To make matters worse, your representatives provided vague responses and abruptly ended the call, showing complete disregard for my concerns. This experience has been frustrating and disappointing. I genuinely regret opening an account with your bank. No customer should be subjected to such treatment, especially when it involves their hard-earned money and financial access. I strongly advise others to think twice before opening an account with your institution, given the level of unprofessionalism and lack of accountability in your service.",,,Unprofessional banking service,-0.9652,0.02,0.825,0.156,negative
jupiter,app_store,12802635348,1,Worst experience with customer service. Seems they are only interested to push their personal loans!!,,,Worst customer service,-0.4559,0.132,0.638,0.23,negative
jupiter,app_store,12800316643,1,"Stupid app, many bugs while applying for credit card. No way to connect to agent. The chat bot is useless.",,,Poor design,-0.7003,0.096,0.593,0.311,negative
jupiter,app_store,12799441749,1,Adhar ekyc is not working. Saying something went wrong please try again later No response for last 8 days.,,,Not working,-0.4588,0.097,0.678,0.225,negative
jupiter,app_store,12798760131,5,Good experience with Jupiter,,,Good service,0.4404,0.492,0.508,0.0,positive
jupiter,app_store,12796504187,1,Waste bank ever they just put charges in the form of debit card charges and annual monthly balance and no response from the customer care,,,Waste,-0.6124,0.099,0.617,0.284,negative
jupiter,app_store,12792676488,1,It’s going to be more than half an year and still it says your video review is getting processed. I don’t know if they know the math that 72 hours is only 3 days.,,,Worst processing speed.,0.0,0.0,1.0,0.0,neutral
jupiter,app_store,12791677710,1,I applied debit card on 7 april till now I didn’t receive any debit card. Customer care simply loot the money . Waste of time trusting u guys and wasted my money too. Shouldn’t have trusted u for my personal savings .,,,Debit card issue,0.4588,0.173,0.712,0.115,positive
jupiter,app_store,12788299289,5,Why is it not updating on my phone. I have proper net and other apps are updating easily,,,Can't access the pot section,0.34,0.124,0.876,0.0,positive
jupiter,app_store,12783749303,1,Worst services,,,Worst,-0.6249,0.0,0.196,0.804,negative
jupiter,app_store,12781911079,1,Perfect for online shopping,,,Superb,0.5719,0.552,0.448,0.0,positive
jupiter,app_store,12781416667,1,"Useless app, don’t install",,,Pathetic,-0.4215,0.0,0.517,0.483,negative
jupiter,app_store,12778209321,1,"My acvount has been freezed and i have tried multiple times connecting with the support and get the issue resolved , false dates and false solutions",,,Worst support team ever in neo banking,0.6249,0.21,0.79,0.0,positive
jupiter,app_store,12776442505,1,Trash,,,Trash,0.0,0.0,1.0,0.0,neutral
jupiter,app_store,12772940454,1,"They offered an upgrade at 500 Rs from Edge to edge+, but they kept multiple conditions like 10% cashback upto ** Jewels , also cashback is not direct as SBI, they give Jewels and you need to redeem them on their platform itself, also another marketing gimmick is you need to spend through their app only, direct buying or card swipe or card otps are not eligible for cashback, now 10% cashback with limits, via upi of theirs and redemption is also on their terms; not at all useful.",,,"First they give mouth water perks, later they devalue the benefits",0.8458,0.113,0.855,0.031,positive
jupiter,app_store,12770672513,1,Extremely frustrating app. I could not find the option to close my upi account on this app. Worst help centre. Please help me to permanently delete my jupiter upi account.,,,Worst experience,-0.1513,0.193,0.625,0.182,negative
jupiter,app_store,12768135097,1,Remains forever stuck at this screen. Can’t even use the app.,,,Stuck at linking your mobile number,-0.25,0.0,0.833,0.167,negative
jupiter,app_store,12764394226,1,"If you’ve extra money to donate to the bank, use this app, otherwise totally avoid. The charges are so hefty and the CS team is so pathetic and blunt to not help you with any reversal that the big banks even do! This is a scam.. they will charge you for a mutual fund SIP miss if it’s not bought from them, and force you to pay as high as 600-700₹ miss on a ₹500-₹1000 SIP miss! Be aware!!",,,Pathetic App! Don’t Fall for the Trap,-0.9634,0.0,0.753,0.247,negative
jupiter,app_store,12757338618,5,Always helping hands single time I doesn’t watch like server down excellent bank I removed aa banks I’m use if only federal Jupiter thanks a lot ❣️💯🙏,,,Excellent,0.9382,0.356,0.644,0.0,positive
jupiter,app_store,12757083026,5,You cannot male upi transaction to merchants. Most of the transactions fails. I have every banks credit card and all other cards works smoothly on every merchant upi mode. But this card doesn’t work. And they also reduce your credit limit.,,,Worst Credit card,0.5106,0.115,0.843,0.042,positive
jupiter,app_store,12754618201,1,app is not working on crucial time not a trusted app dnt download,,,app not working,-0.3724,0.0,0.825,0.175,negative
jupiter,app_store,12753470218,5,"While the card itself offers decent features, the customer service experience has been extremely disappointing. The customer service number never connects — it just plays an automated reply and then disconnects. Even the in-app chat support on the Jupiter app is unhelpful; it gives the same generic responses every time and doesn’t actually address or solve the issue. It feels like there’s no real support available when you actually need help. Overall, the worst customer service experience I’ve had.",,,"Card is decent, but customer service is the worst",-0.2619,0.138,0.734,0.128,negative
jupiter,app_store,12749098125,5,"App service and interface is best The issue is with the rewards point by showing 10* rewards in shopping now i get only 1* rewards in shop shopping, 10* is only in online shoping and for this i pay 500 rupees more",,,Rewards just got less,0.9201,0.26,0.713,0.027,positive
jupiter,app_store,12738808904,4,App great with some quirky bits but please add widgets like phone pe,,,QR scan widget,0.8294,0.467,0.533,0.0,positive
jupiter,app_store,12735809768,1,They will hold your amount for a long time and there customer support team also provides false dead line …if you have lots of money to block please download it and see,,,Don’t trust on this app,-0.4939,0.124,0.697,0.179,negative
jupiter,app_store,12735771699,3,"I like the overall aesthetics and usability of the app but their money section is very confusing. I like the way ""Fold Money"" app has done the same thing but in a much simpler and cleaner way.",,,Best app but little flawed,0.5656,0.172,0.763,0.065,positive
jupiter,app_store,12733785550,1,Some of the features not working properly such as scroll down and biometric open. Can you fix this kind of issue?,,,Bugs and issues,0.0,0.0,1.0,0.0,neutral
jupiter,app_store,12722104592,1,Many times transaction is either later or doesn’t show up or is not completed leaving me embarrassed in front of people i highly talk about jupiter! It’s so frustrating…,,,Incomplete transactions,-0.4199,0.0,0.909,0.091,negative
jupiter,app_store,12708844782,1,"It’s really frustrating that the credit card apply option is disabled and it’s not showing why its disabled also if you sign up with this app you will not be able to delete your account as app doesn’t allow it it’s a really a concern also they don’t even allow you to properly edit your general information , such a worst app, I have seen first thing in my life. Use this app if you don’t believe in the above concerns.",,,"Security is concern , Worst app not able to apply for credit card also not able to remove my account",-0.4391,0.071,0.847,0.081,negative
jupiter,app_store,12700167357,1,No one attend the calll and no one support in chat support also ! Stay away from this application,,,Poor Customer support,-0.5023,0.11,0.609,0.282,negative
jupiter,app_store,12697047375,5,"Best app for banking , I am used this app by 3 year’s no issues ever, app interface is so cool and smooth, Best part is saving in pots featur, never going’s server down, over all It’s fire App , to good",,,Best online Bank Ever I seen,0.8932,0.26,0.656,0.084,positive
jupiter,app_store,12691124747,5,"With Autopay on Jupiter, my bills are sorted every month, and I earn Jewels that actually reduce next month’s payments.",,,Bills on Autopay,0.4588,0.136,0.864,0.0,positive
jupiter,app_store,12689420364,2,"The app won’t let us cancel the debit card and they charge around 300 for every year. The product should be easy to use customers. If we choose to close the account the application will treat us like the idiots and the support is horrible. They only follow the POC and we will not get the straight answer. If we don’t have a account and have a credit card its absolutely a nightmare, we can’t use the app to pay the credit card bill and we need to reach out to the support every month to provide with a link for card payments. I hope the product will improve and lets the previous customers return and reopen or open a complete new account. And help to retain and or welcome the old customers. Really expected a lot when I was referred to the app and very disappointed how things turned.",,,Very overrated,0.9541,0.178,0.755,0.068,positive
jupiter,app_store,12683583504,1,Don’t open anything in this worst bank. I am regretting enough already.,,,Not working banking with worst customer support,-0.8213,0.0,0.569,0.431,negative
jupiter,app_store,12677583910,1,App on iphone se 2020 not showing settings option or three lines button on iphone se 2020 due to which i am unable to view account details. Being a PRO user not providing this option is pathetic. This option shows up on other iphone models but not on mine. Please resolve asap,,,App not showing settings option and three lines button,-0.101,0.059,0.857,0.084,negative
jupiter,app_store,12675684261,1,"Cannot login and reset mpin. Account locked, worst experience.",,,Mpin error.,-0.6249,0.0,0.661,0.339,negative
jupiter,app_store,12674167997,5,Genuinely curious 🫡 for Armed Forces 🙇,,,Service,0.3182,0.247,0.753,0.0,positive
jupiter,app_store,12664350793,2,Giving two starts for their pathetic support. Support is so bad that they ask for video attachment even though is already attached in the email.,,,Waiting for my upi issue fix for more than a week,0.1298,0.274,0.521,0.205,positive
jupiter,app_store,12659733442,5,SIP reminders on Jupiter have helped me make investing a habit.,,,I save more than ever before!,0.0,0.0,1.0,0.0,neutral
jupiter,app_store,12658075772,5,I use the rewards I earn on Jupiter to buy Digital Gold and invest extra every month!,,,Growing my savings,0.5255,0.175,0.825,0.0,positive
jupiter,app_store,12654641463,1,"I used my Jupiter debit card to purchase an iPhone from Amazon Dubai. However, due to security concerns, Amazon cancelled the order. Unfortunately, Jupiter charged forex fees on both the original transaction and the refund. As a result, I lost around ₹5,000 without receiving the product. Just a heads-up — avoid using the Jupiter card for international transactions to prevent such losses.",,,Don’t use Jupiter for international transaction,-0.6369,0.125,0.693,0.182,negative
jupiter,app_store,12652433603,1,"I did vKYC and it was approved. Then I tried to put money in their FD, which is named POTS. But whenever I try to put money, the app asked me to do VKYC again, so I contacted their customer support and I did not got any fruitful response. All I got was as we are looking into this. We will do it in three days- two days. I got this response every time and I had to explain my situation to them every time. This was very frustrating in the end. I had put some money in the account because you have to put some amount to activate the account and i transferred that money into my main account and I asked the customer support to shut my account. I don't want to use it. I was informed it will take two weeks for the account to be closed. They have a very pathetic customer support. Please don't go there. If they can take so much time in such a small thing and also not resolve it, what will they do if your money gets stuck due to some mess up on theor end or transaction gets failed and money is deducted, I don't think they would be able to handle this please don't go for this app",,,vKYC is not godd,-0.6961,0.078,0.826,0.097,negative
jupiter,app_store,12650483862,2,I have iPhone X but it has no updates of IOS 17 so please allow me to use your app,,,I’m Not Able To Use Your App,0.6065,0.254,0.64,0.105,positive
jupiter,app_store,12645389805,1,They said I’ll get a assorted cash back if I pay through Jupiter but I didn’t receive any cash back,,,Fake promises,-0.0516,0.0,0.941,0.059,negative
jupiter,app_store,12639999005,2,Unable to create pots after the new Pots UI revamp. Now super pots are renamed to RDs it seems. Sounds good. But the thing is after this revamp I’m unable to create any pots. And the chat bot is also pretty annoying not giving me correct answers. I want to create pots. It’s the solren reason I created an account in Jupiter. My previous pots are working fine. But I’m unable to create a new one now.,,,Pot Creation,0.9354,0.255,0.681,0.064,positive
jupiter,app_store,12638610599,1,"I invested using their magic spends, now i cant redeem my mutual fund , their customer support is worst, they are scamming people",,,Dont invest in mutual fund in this app,-0.34,0.097,0.755,0.147,negative
jupiter,app_store,12633720250,1,Worst app I have been used this credit card for 1 month I am unable to use this card where ever I want and also I have closed this credit card,,,Customer care support is also worst I have requested team to delete data from Jupiter app no respons,0.296,0.19,0.703,0.107,positive
jupiter,app_store,12625502382,1,"I am trying to repay my instalment, it is just giving me options of netbanking and when I am choosing bank, it directly saying payment failed. Now they will charge me because my instalment got failed due to their errors. I will not recommend this app to anyone ever!!",,,Worst app ever,-0.8517,0.041,0.757,0.201,negative
jupiter,app_store,12623530360,1,"I am wondering in gurgaon they are not issuing card , which so surprising since it’s prime location.",,,Location issue,0.4101,0.139,0.861,0.0,positive
jupiter,app_store,12622376361,1,"""Misleading and Deceptive Practices"" I was initially drawn to ""JUPITER"" because of their promise of ""ZERO FEES"" and ""NO CHARGES"". However, this turned out to be a blatant lie! After years of banking with them, they suddenly started charging me fees without any prior notice. The lack of transparency and communication is appalling. It's clear that they're looking to nickel-and-dime their customers to boost their bottom line. *WARNING:* If you're considering banking with ""JUPITER"" be aware that their promises are empty, and you'll likely end up getting burned. *UPDATE:* I'll be taking my business (and my complaints) elsewhere!",,,AVOID THIS BANK AT ALL COST,-0.81,0.088,0.752,0.16,negative
jupiter,app_store,12617423651,1,"Wanted to use the app for tracking multiple banks, half of the features mentioned are not even visible. No option to remove added bank accounts visible upfront.",,,Poor,0.2235,0.068,0.932,0.0,positive
jupiter,app_store,12602042823,1,They keep charging one after the other when we asked to close the account. Can’t do the debits properly and not able to cater the request even after 2 weeks. It’s our responsibility to make sure they deduct the charge and it is our responsibility to ask them about the closure. Useless team.,,,Zero balance account turns out 5000 min balance,-0.128,0.041,0.909,0.05,negative
jupiter,app_store,12597996913,1,They had scammed me once and I stopped using the app. I thought I would close my account and ask to delete my account. Turns out they changed terms again and kept pending fees on my account. Now I can’t close my account either. They find new ways to disappoint,,,Continued poor experience,-0.5574,0.0,0.913,0.087,negative
jupiter,app_store,12592415963,1,"Collects all the data unnecessarily and denies later, saying non eligibility requirements. Too trash",,,Trash app,-0.4215,0.0,0.823,0.177,negative
jupiter,app_store,12591575325,1,I want to close my account and the customer support is not even replying to me. Even on weekdays they are not replying to my query. The whole experience is so disappointing.,,,Bad customer support,-0.2769,0.108,0.781,0.111,negative
jupiter,app_store,12589360377,4,Please add dark mode.,,,Add Dark Mode,0.3182,0.434,0.566,0.0,positive
jupiter,app_store,12586848143,5,Awesome,,,Amazing,0.6249,1.0,0.0,0.0,positive
jupiter,app_store,12572049921,5,They are giving credit card to me,,,Cc,0.6124,0.5,0.5,0.0,positive
jupiter,app_store,12570682781,1,I have ios 15.8 but this app show not compatible for this device. And app details show it’s working iOS 13 or later versions.,,,App install but not working,0.0,0.0,1.0,0.0,neutral
jupiter,app_store,12569562266,1,This service is unreliable; 99% of transactions fail and often provide incorrect reasons for the failure.,,,Worst credit card ever used,-0.7783,0.0,0.673,0.327,negative
